Text,Label
guess which pub i i m as happy as pig clover or,Non-Spam
there be someone here that have year lt gt toyota camry like mr olayiwola s mileage lt gt k it clean but need know how much will it sell if can raise dough for it how soon after land will it,Non-Spam
still look pick,Non-Spam
since ayo travel he have forget,Non-Spam
well its not like actually call someone that woulda,Non-Spam
go head,Non-Spam
can talk,Non-Spam
esplanade,Non-Spam
happy new hope be have,Non-Spam
just look it up addie go back monday suck,Non-Spam
my drive can only be,Non-Spam
hey kate hope ur ok will give buz go outsomewhere 4 adrink town cud go 2watershd 4 ppl fromwrk will,Non-Spam
m hungry buy,Non-Spam
we make eta at taunton 12 30 as plan hope that s still good,Non-Spam
so your tell i coulda be your real valentine be never pick i,Non-Spam
,Non-Spam
no m not m school so if we rush we,Non-Spam
that be y haf 2 keep,Non-Spam
do not let study stress,Non-Spam
network,Non-Spam
thinkthis time lt gt pm,Non-Spam
say its,Non-Spam
so what,Non-Spam
spend new year with my brother his lets plan meet next be ready,Non-Spam
jade its y didn t txt do remember i from want 2 talk,Non-Spam
boy be late 2 his father power,Non-Spam
be keep those pix,Non-Spam
yar tot know dis would happen long,Non-Spam
aiyo so poor thing then dun wan 2,Non-Spam
oop be show when hey parking garage collapse at university see m not stuff like that,Non-Spam
m hope be do,Non-Spam
hey come use msn we be,Non-Spam
we be suppose meet discuss abt our trip think xuhui think we can go for lesson,Non-Spam
will cme want go hos after that wil this what get from her dear what she do not say,Non-Spam
future not what we plan for it result of what we do do well present,Non-Spam
few people be at game m at mall with,Non-Spam
want see your,Non-Spam
,Non-Spam
bit of ur smile my hppnss drop of ur tear my sorrow part of ur heart my life heart like mine wil care for forevr as,Non-Spam
want lt gt rs da do,Non-Spam
what mean be leave too early check cos m work,Non-Spam
why do not call on,Non-Spam
m vivek get call from,Non-Spam
ahhhh just wake have bad dream about tho so do not like right now do not know anything about comedy night but guess i m up,Non-Spam
do my when will buy bb cos have for sale how,Non-Spam
come back 4 dinner dad ask i so re,Non-Spam
lose 4 pound since my doc visit last week woot now m go to celebrate by stuff,Non-Spam
hi baby i m sit on bloody bus at mo will not be home until about 7 30 wan na do somethin call i later ortxt back,Non-Spam
hi its i be probably have too much fun get this message but think i d txt cos i m james have be fart at i,Non-Spam
be bus on,Non-Spam
m already back home so no,Non-Spam
anyway do not think can secure anything up here lem i know if want i drive down,Non-Spam
wrong this answer this one but assume other people do,Non-Spam
check mail i have mail varma keep copy regard membership take care,Non-Spam
m eatin now lor but goin back work soon e mountain deer show huh watch b4 liao,Non-Spam
omg can make wedding chapel why do they get all,Non-Spam
go home ask dad pick i up,Non-Spam
tomarrow want get at lt decimal so come bus stand,Non-Spam
no it be cancel yeah well that sound important so understand my darlin give i ring later on this fone love,Non-Spam
g want know where,Non-Spam
k,Non-Spam
hey babe how be it do ever figure out where your go for,Non-Spam
hey do want,Non-Spam
once free call,Non-Spam
match started india lt gt,Non-Spam
good morning my how be those yummy where be my sexy bun what do do do think of do crave do,Non-Spam
just hope that wasn t too piss up remember have go off his sister,Non-Spam
wan na do some,Non-Spam
oh yes why it like torture,Non-Spam
ok let noe when leave,Non-Spam
we can go 4 e normal pilate after,Non-Spam
oh yah we never cancel,Non-Spam
hi dear call i its do not know what s your do not want work or if have any other problem at least tell wate for,Non-Spam
its so common hearin how wat r how be ur so let i ask something do smile if not do it now,Non-Spam
g say never answer your text,Non-Spam
re your call do not see my,Non-Spam
sit mu wait for everyone get out of my suite so can,Non-Spam
just drop em off omw,Non-Spam
we take hooch for walk toaday fall graze my knee should have stay at,Non-Spam
ve already get flaky it snot suppose be child s job support parent not until they be ride age anyway m suppose be there now ve but,Non-Spam
be on,Non-Spam
love that holiday monday feel even if have go dentist,Non-Spam
we regret inform that nhs have make mistake u be never actually born please report 2 yor local hospital 2b terminated we r sorry,Non-Spam
will do have,Non-Spam
m solihull do,Non-Spam
then,Non-Spam
will come online,Non-Spam
no do not mean post write it like so many other time ve ritten stuff let it sit it be what be feel at time be before leave hit send then it be not check on my phone when get my it be not say do not sleep be so why would not that be time clean fold laundry at least,Non-Spam
m reach another,Non-Spam
taka wat time wan 2 come n look,Non-Spam
haha that be first person be go,Non-Spam
oh for fuck s sake she be,Non-Spam
can not pick phone right pls,Non-Spam
2 half year miss,Non-Spam
convey my,Non-Spam
send i,Non-Spam
they do not tell that side effect of birth control be massive gut wrench cramp for first 2 do not sleep at all,Non-Spam
its bad if if use half way then its well for he,Non-Spam
sound like there could be lot of time spend that chastity device boy grin or take your beating like good go lounge nice long,Non-Spam
japanese proverb if one can do it too can do it if none can do it must do it indian version if one can do it let he do it if none can do it leave finally kerala version if one can do it stop he do it if none can do it make strike,Non-Spam
have pls make note of all she s also find out from her school if anyone else be there dog or cat let i,Non-Spam
or just do,Non-Spam
poor girl can not go one,Non-Spam
for many thing its an antibiotic it can be use for chest abdomen gynae infection even,Non-Spam
new theory argument win d situation but lose so do not argue with ur friend kick they amp say m,Non-Spam
as usual can call i ard,Non-Spam
when where do,Non-Spam
alright tyler be get minor crisis have be home soon than he think so be,Non-Spam
yeah just open chat click friend then make easy,Non-Spam
world s most happy frnd never have same character dey just have good understanding of,Non-Spam
know dat feelin have it with wuld get with em nuther place nuther,Non-Spam
wat happen,Non-Spam
oops,Non-Spam
hi dis yijue would be happy work wif all,Non-Spam
know what,Non-Spam
dip s cell so m come with well respond else we shall,Non-Spam
tension face smile face waste face innocent face 5 terror face 6 cruel face 7 romantic face 8 lovable face 9 decent face lt gt,Non-Spam
watch cartoon listen music amp at eve have go temple amp church,Non-Spam
okey dokey swashbuckling stuff,Non-Spam
shit think that be your loooooool that just make so much more sense now grin sofa reference be sleep on couch link send i be not that how go on your oh do not your babe go with for that celebration with,Non-Spam
m really sorry light your hair,Non-Spam
sorry da today will not come play have,Non-Spam
nokia,Non-Spam
response one of d powerful weapon 2 occupy place other heart so always give response 2 who care 4 gud night swt dream,Non-Spam
hey guy know breathe down my neck get he some bud anyway would be able get half track,Non-Spam
,Non-Spam
or bomb date as my phone,Non-Spam
yes need stretch open,Non-Spam
,Non-Spam
also north carolina texas atm would just go gre site pay for test result,Non-Spam
m hope,Non-Spam
like your,Non-Spam
gain right of wife dont demand it i be try as husband too,Non-Spam
maybe should find something else,Non-Spam
either way work for am lt gt year hope that do,Non-Spam
s this will increase chance,Non-Spam
be escape theatre going watch kavalan,Non-Spam
pls help i tell ashley that can not find her,Non-Spam
miss too pray,Non-Spam
need detail about that,Non-Spam
awesome that go to be soon or,Non-Spam
hmmm mayb can try e shoppin area one but forget e name,Non-Spam
that be one of issue but california no snow so,Non-Spam
all boy make fun of i ok have no just send one message just,Non-Spam
photoshop make my computer,Non-Spam
yay can not wait,Non-Spam
oh well i m with my good mate pete who go out with 4 week now be 2geva its be long,Non-Spam
hope your pee,Non-Spam
hey do ever vote for,Non-Spam
po no need,Non-Spam
word checkmate chess come from persian phrase shah maat which mean king dead goodmorning have,Non-Spam
how long before get reply just defer admission til,Non-Spam
lol just try make your day little,Non-Spam
yup but it be not give i problem now so mayb will jus,Non-Spam
haha just what,Non-Spam
be go sleep be tired,Non-Spam
not think bout it drink tap spile at that pub on gas st off broad st by,Non-Spam
,Non-Spam
i m have be,Non-Spam
get small capacity,Non-Spam
how be,Non-Spam
i mark take forever pick up my prescription pain,Non-Spam
anything valuable only 2 situation first before get it second after,Non-Spam
no home work,Non-Spam
ummmmmaah many many happy return of d day my dear sweet heart happy,Non-Spam
can call lt gt min if that,Non-Spam
fyi m at usf now swing by,Non-Spam
e admin building might b slightly early will call when,Non-Spam
honey can pls find out how much they sell predicte how many time can it be its very important have reply,Non-Spam
do not worry though understand how important it that be put my place with poorly think out punishment face of bad thing that have ever happen brb go to go,Non-Spam
what be up my own leave my phone at home just see ur hope be have,Non-Spam
call i when finish then come,Non-Spam
sorry for,Non-Spam
er hello thing didn t quite go plan limping slowly home follow by aa with exhaust,Non-Spam
how do plan,Non-Spam
reverse that,Non-Spam
guy at car shop who be flirt with i get my phone number from paperwork call texte i m nervous because of course now he may have my should call his boss tell he know this may get,Non-Spam
its cool but tyler have take off so we be go to buy for he drop it off at his place later our total order quarter,Non-Spam
do not know why she s not get,Non-Spam
just come do not want,Non-Spam
see guy doll last night with patrick swayze it,Non-Spam
sorry that be my i ll,Non-Spam
or ask they all if next sit can if all of they can make it then m,Non-Spam
gd luck 4,Non-Spam
send i,Non-Spam
izzit still rain heavily cos m e mrt can not,Non-Spam
we be on opposite side from where we,Non-Spam
yup we come back on finish dinner go back 2 hotel time fly we be tog 4 exactly mth hope we will haf many more,Non-Spam
thk of wat,Non-Spam
holy live christ what take,Non-Spam
indeed by way it be either or,Non-Spam
especially since talk about boston all up my personal statement woulda change that if have realize it say it say,Non-Spam
call i be senthil,Non-Spam
yup hey then one day on fri we can ask miwa jiayin take leave,Non-Spam
sen tell that he going join his uncle,Non-Spam
o we can not see if we can join denis or do deni want,Non-Spam
r most beautiful girl i ve ever r my baby come c i,Non-Spam
sorry completely forgot will pop em round this week if your,Non-Spam
quite lor but dun tell he wait he,Non-Spam
so many people seem be special at first sight but only very few will remain special till your last sight maintain they till life end,Non-Spam
repeat e instruction wat s e road name of,Non-Spam
ok then tell i wat time come,Non-Spam
hi mobile no lt gt have add their contact list on www fullonsms com it s great place send free sms people for more visit,Non-Spam
hi get,Non-Spam
cheer yeah be goodnite shame neva come c,Non-Spam
watever relation build up dis world only thing which remain atlast iz lonline with lotz n lot,Non-Spam
m not sure if its still,Non-Spam
when s your,Non-Spam
if text on your way cup stop that should that should,Non-Spam
technical support providing assistance we customer through,Non-Spam
prepare,Non-Spam
i have lovely,Non-Spam
it be only 140 ard rest all ard 180 at least which price 4 2,Non-Spam
m doc give i pain med say,Non-Spam
hey look like be wrong one of kappa guy number still on my phone if want can text he see if he,Non-Spam
do not make life too stressfull always find time laugh it may not add year your life but surely add more life ur gud ni8,Non-Spam
wan 2 haf lunch m da,Non-Spam
ok lor or wan i go,Non-Spam
well boy be glad g waste all night at applebee,Non-Spam
if be still up maybe leave credit card so can get gas when get back like he,Non-Spam
thanx darlin i m cool few bday drink 2 2morrow take care c,Non-Spam
beauty of life next second which hide thousand of wish every second will be wonderful ur,Non-Spam
when just put sign choose my number pin will,Non-Spam
orh tot say she now still,Non-Spam
think,Non-Spam
be hospital will return,Non-Spam
ya very be ready,Non-Spam
many more happy return of wish,Non-Spam
keep see weird shit bein all woah then realise it be actually reasonable m,Non-Spam
we have pizza,Non-Spam
buy test its something that let know exact day ovulate when will get 2u about 2 but pls pls do not know r pls also there anything ur past history need,Non-Spam
not only for drive even for many reason she call bbd tht it chikku then hw abt dvg cold hear tht vinobanagar violence hw condition hw,Non-Spam
not for possession especially not,Non-Spam
oh k after that placement,Non-Spam
good morning my dear shijutta have great amp,Non-Spam
wat time r go xin,Non-Spam
k eng,Non-Spam
do not know ask my nothing problem some thing that,Non-Spam
ve,Non-Spam
career tel have add as contact on indyarocks com send free remove from phonebook sms no,Non-Spam
jason say it be cool if we pick some up from his place like,Non-Spam
there will be minor shindig at my place later,Non-Spam
hello my cake,Non-Spam
m home my love if your still awake,Non-Spam
anything lor if dun wan it,Non-Spam
forgot tell smth can like number section so that it,Non-Spam
aiyo her lesson so early m still sleepin haha okie go home liao den confirm w,Non-Spam
my uncle wish guy,Non-Spam
k will do addie amp be do some art so will be here when,Non-Spam
hey what switch off ur cell d whole this be not now if do care give i,Non-Spam
s 8 min go,Non-Spam
oops thk dun haf enuff go check,Non-Spam
big brother s really scrape barrel with this shower of,Non-Spam
that s cool will cover your face hot,Non-Spam
huh so slow tot reach long ago liao 2 more day only 4,Non-Spam
ya knw vl giv its ok thanks kano anyway enjoy wit ur family wit,Non-Spam
haha awesome might need take up on that what,Non-Spam
do say bold then torch or one,Non-Spam
wif my family book,Non-Spam
wow so old airport rd can not thk of anything but will b bathe my,Non-Spam
hey,Non-Spam
yar but they say get,Non-Spam
mmmmmmm snuggle into deep contented sigh whisper fucking love so much can barely,Non-Spam
,Non-Spam
like,Non-Spam
,Non-Spam
don no da what,Non-Spam
okey dokey i ll be over bit just sort some,Non-Spam
guy who get use but too dumb,Non-Spam
pls give her food preferably pap very slowly with load of can take up an hour give it then some very,Non-Spam
tessy pls do i pls convey my birthday wish nimya pls dnt forget today her,Non-Spam
by march end should be but will call for problem that my capital never how far how be,Non-Spam
surly ill give it while,Non-Spam
ok,Non-Spam
do not try g decided not,Non-Spam
hmmm but should give it on,Non-Spam
eatin,Non-Spam
but pls do not play,Non-Spam
alright we will bring it see like lt,Non-Spam
my life mean lot i not because love my life but because love people my life world call they friend call they my,Non-Spam
ok can take i shop when get,Non-Spam
haha yeah 2 oz kind,Non-Spam
be,Non-Spam
that be cool he will be here all night lem i know when,Non-Spam
sry da jst nw only,Non-Spam
it good thing m now get,Non-Spam
wewa iriver all,Non-Spam
ready then,Non-Spam
m leave my,Non-Spam
forget 2 ask all smth there be card on da present lei all want 2 write smth or sign,Non-Spam
probably not m almost out of gas get some,Non-Spam
do not get ur full msg sometext miss send,Non-Spam
when be bear god say oh another when be bear god say oh who know one day these two will become,Non-Spam
i m realy soz imat my mums 2nite what,Non-Spam
send print,Non-Spam
not tel,Non-Spam
ok set let noe e,Non-Spam
mum not go,Non-Spam
yes,Non-Spam
lady first genus,Non-Spam
ok,Non-Spam
call he tell now infront of call,Non-Spam
can not pick phone right pls,Non-Spam
this message from great doctor india 1 do not drink appy it contain cancer,Non-Spam
k will work,Non-Spam
our prasanth ettans mother pass away last just pray for,Non-Spam
hope be have,Non-Spam
lol but it will add some spice,Non-Spam
where r e,Non-Spam
finally it have aftr beer now cheap than goverment expect we but do,Non-Spam
please protect yourself from e sib never ask for sensitive information like password atm sms pin thru never share your password,Non-Spam
we be go sleep,Non-Spam
god create gap btwn ur finger so dat sum1 vry special will fill those gap by hold ur hand now plz do not ask y he create so much gap,Non-Spam
be plan,Non-Spam
do got that,Non-Spam
sorry din lock,Non-Spam
,Non-Spam
do hide anythiing or keep distance,Non-Spam
of guess god be just get i on hold,Non-Spam
captain vijaykanth do comedy captain tv,Non-Spam
oh this first time use these type,Non-Spam
k k pa have your,Non-Spam
how come din c yup cut,Non-Spam
these will not do have move,Non-Spam
oh wow that s will firmware,Non-Spam
m meet call i,Non-Spam
get hella gas money want go on grand nature adventure with galileo,Non-Spam
everybody have fun this,Non-Spam
only saturday sunday holiday so its,Non-Spam
lol know that see he,Non-Spam
m on,Non-Spam
jus finish blow my finish,Non-Spam
need my presnt always bcz can not mis jeevithathile irulinae neekunna prakasamanu sneham prakasam ennal prabha that mns prabha is love get it do not,Non-Spam
they finally come,Non-Spam
receive understand n,Non-Spam
this long,Non-Spam
sorry will call,Non-Spam
nvm m going wear my sport shoe anyway m going be,Non-Spam
do think could send i some would love see your,Non-Spam
call,Non-Spam
how s my favourite person r workin could not sleep again last nite nearly rang at,Non-Spam
how much get,Non-Spam
sorry go mad so many pende work,Non-Spam
wat,Non-Spam
just glad,Non-Spam
this 2nd time we have try 2 contact u have win 750 pound 2 claim easy call 087187272008 only 10p per bt,Spam
reminder from o2 get 2 50 pound free call credit detail of great offer pls reply 2 this text with your valid name house,Spam
ask 3mobile if 0870 chatline inclu free india cust servs se l8er get mega 3 do not giv bailiff due o 250 3,Spam
want explicit sex 30 ring 02073162414 cost 20p min gsex pobox 2667,Spam
your 2003 account statement for show 800 un redeem s i m call 08718738001 identifier code 49557 expire 26,Spam
be award sipix digital call 09061221061 from delivery within t cs 2yr p p,Spam
your 2003 account statement for 07808247860 show 800 un redeem s i m call 08719899229 identifier code 40411 expire 06,Spam
sms for your inclusive text credit pls goto www comuk net login 3qxj9 unsubscribe with stop no extra help 08702840625 220,Spam
marvel mobile play official ultimate spider man game 4 50 on ur mobile right text spider 83338 for game we ll send free,Spam
2p per min call germany 08448350055 from your bt just 2p per check planettalkinstant com for info t s c text stop,Spam
urgent we be try contact last weekend draw show have win 1000 prize guarantee call 09064017295 claim code k52 valid 12hrs,Spam
last weekend s draw show that have win 1000 cash or spanish call now 09050000332 t c rstm sw7,Spam
get your garden ready for summer with free selection of summer bulbs seed worth 33 50 only with scotsman this stop go2 notxt,Spam
http widelive com id 820554ad0a1705572711 first true c,Spam
txt call no 86888 claim your reward of 3 hour talk time use from your phone subscribe6gbp mnth inc 3hrs 16 txtstop www,Spam
december have your mobile be entitle update late colour camera mobile for free call mobile update co free,Spam
for most sparkling shopping break from 45 per person call 0121 2025050 or visit www shortbreaks,Spam
late police station toilet steal cop have nothing,Spam
have win guarantee 32000 award or maybe even 1000 cash claim ur award call free on 0800 its legitimat efreefone number wat,Spam
santa would your little one like call from santa xmas call 09058094583 book,Spam
have 1 new call 0207,Spam
free entry gr8prizes wkly comp 4 chance win late nokia 8800 psp or 250 cash every wk txt great 80878 http www gr8prizes,Spam
current leading bid pause this auction send customer,Spam
date have have two of only start after send text talk sport radio last any connection do think,Spam
important this final contact have important message wait out our customer claim expire 13 4 call,Spam
400 xmas reward wait our computer have randomly pick from our loyal mobile customer receive 400 just,Spam
call 09095350301 send our girl into erotic just 60p stop text call 08712460324,Spam
r subscribe 2 textcomp 250 wkly 1st s free question follow subsequent wks charge 150p msg 2 unsubscribe txt stop 2 84128,Spam
get official england poly ringtone or colour flag on yer mobile for tonight text tone or flag optout txt eng stop box39822 w111wx,Spam
xmas iscoming ur award either 500 cd gift voucher free entry 2 r 100 weekly draw txt music 87066 tnc www,Spam
please call 09061213237 from 5000 cash or luxury 4 canary island holiday await t cs sae po box 177,Spam
have win 1 week free membership our 100 000 prize txt word claim no 81010 t c www dbuk net lccltd,Spam
your mobile number have be award with 2000 prize guarantee call 09061790126 from land claim valid 12hrs,Spam
if do not your prize will go another t c at www t c biz 18 150p min polo ltd suite 373 london w1j 6hl please call back,Spam
please call 09061213237 from 5000 cash or 4 holiday await t cs sae po box 177,Spam
someonone know try contact via our date find out who it could be call from your mobile or landline,Spam
be choose receive 350 pls call claim number 09066364311 collect your award which be select receive as value,Spam
your 2003 account statement for fone no show 800 un redeem s i m call 08715203656 identifier code 42049 expire 26,Spam
natalja 25 f invite be her reply yes 440 or no 440 see she www sms ac u nat27081980 send stop,Spam
have your mobile update for free orange late colour camera mobile unlimited weekend call mobile upd8 on freefone 08000839402,Spam
ve your 4 costa del sol holiday or 5000 await call 09050090044 now sae tc s pobox334 stockport sk38xh cost 1 50,Spam
call germany for only 1 penny per call from fix line via access number 0844 861 85 no direct www telediscount,Spam
spook up your mob with halloween collection of logo pic message plus free eerie tone txt card spook 8007 ze 08701417012150p per,Spam
our record indicate maybe entitle 5000 pound compensation for accident claim 4 free reply with claim this msg 2 stop,Spam
ree entry 2 weekly comp for chance win an txt pod 80182 get entry std txt rate t c s apply 08452810073 for,Spam
sms auction brand new nokia 7250 up 4 auction auction free 2 join take txt nokia,Spam
congrat 2 mobile 3 g videophone r call 09063458130 videochat wid ur mate play java game dload polyph music noline,Spam
get your garden ready for summer with free selection of summer bulbs seed worth 33 50 only with scotsman this stop go2 notxt,Spam
free for 1st no1 nokia tone 4 ur mobile every week just txt nokia 8077 get txte tell ur www getzed co uk pobox 36504 w45wq 16,Spam
ve your 4 costa del sol holiday or 5000 await call 09050090044 now sae tc s pobox334 stockport sk38xh cost 1 50,Spam
your 2003 account statement,Spam
get 3 lion england tone reply lionm 4 mono or lionp 4 4 more go 2 www ringtones co uk original n tone 3gbp network operator,Spam
december have your mobile be entitle update late colour camera mobile for free call mobile update vco free,Spam
have 1 new please,Spam
this msg for your mobile content order it have be resent as previous attempt fail due network error query customersquerie netvision,Spam
themob hit link get premium pink panther game new no 1 from sugababe crazy zebra animation or badass hoody wallpaper all,Spam
do want new nokia 3510i colour phone with 300 free minute any mobile 100 free text free camcorder reply or,Spam
this 2nd attempt contract have win this week top prize of either 1000 cash or 200 just,Spam
win 200 shopping spree every week start 2 play text store tscs08714740323 age16,Spam
5p 4 alfie moon s child need song on ur tell ur txt tone charity 8007 for nokias or poly charity for poly ze 08701417012 profit,Spam
83039 62735 450 uk break accommodationvoucher term condition 2 claim mustprovide your claim number,Spam
free video camera phone with half price line rental for 12 mth 500 cross ntwk min 100 txt call mobileupd8 08001950382 or,Spam
double min double txt 1 2 price linerental on late orange bluetooth call mobileupd8 for very late 08000839402 or,Spam
get your free wallpaper text heart 88888 t c 16 need,Spam
natalie 20 f invite be her reply yes 165 or no 165 see she www sms ac u natalie2k9 send stop,Spam
will not believe it but it be it be incredible reply g now learn truly amazing thing that will blow your from o2fwd only,Spam
would like tell my deep darkest call i 09094646631 just 60p stop text call 08712460324,Spam
your 2003 account statement for show 800 un redeem s i m call 08715203685 identifi code 4xx26 expire 13,Spam
ur cash balance currently 500 pound maximize ur cash in now send go 86688 only 150p cc 08718720201 hg suite342 2lands,Spam
dear 0776xxxxxxx ve be invite this our final attempt txt chat 86688 150p msgrcvdhg suite342 2lands row w1j6hl,Spam
have win guarantee 1000 cash or 2000 claim yr prize call our customer service representative on 08714712412 between 10am 7pm,Spam
cd 4u congratulation ur award 500 of cd gift voucher or 125 gift guarantee freeentry 2 100 wkly draw xt music 87066 tnc www,Spam
