Text,Label
its true,Non-Spam
guy do some bitching but act like would be interested buy something else next week he give it we,Non-Spam
pity be mood for so any,Non-Spam
will b go esplanade,Non-Spam
huh,Non-Spam
why do not wait til at least wednesday see if,Non-Spam
ard 6 like,Non-Spam
ok lor sony ericsson salesman ask shuhui then she say quite gd 2 use,Non-Spam
get i out of this dump my mom decide come,Non-Spam
anything juz both of,Non-Spam
if be not here next lt gt hour imma flip,Non-Spam
sorry will,Non-Spam
mean calculation that lt gt unit at lt this school really have start practice your because its important have decide if be do 4years of dental school or if will just do,Non-Spam
yes so that be why pshew miss,Non-Spam
indians be tho it do kane i off bit he we shud go out 4 drink sometime mite hav 2 go 2 da work 4 laugh soon love pete,Non-Spam
well keep mind ve only get enough gas for one more round trip bar sudden influx,Non-Spam
hahaha use your,Non-Spam
have safe trip wish happiness very soon company share,Non-Spam
wen do get so spiritual that,Non-Spam
cool what time think can,Non-Spam
know wot people t shirt jumper hat belt all we we r,Non-Spam
no be try it all,Non-Spam
there be lotta childporn,Non-Spam
hi its durban be still on,Non-Spam
m take derek amp taylor walmart if m not back by time be do just leave mouse on my desk will text when priscilla,Non-Spam
still have not get urself,Non-Spam
armand say get your ass,Non-Spam
yeah it be,Non-Spam
just,Non-Spam
can not believe how attached be see every know will do well can get i will go teach my class at,Non-Spam
aiyah ok wat as long as get improve can,Non-Spam
know be thinkin but relax child can not handle she would have be bad its if she take enough replace her loss her temp will if give her malaria med now she will just its self limit illness she have which mean few day it will,Non-Spam
ok which your,Non-Spam
hey chief can give i bell when get need talk about this royal visit on,Non-Spam
happen here while,Non-Spam
be away from how,Non-Spam
think that tantrum s finish so yeah will be by at,Non-Spam
what about this,Non-Spam
its just effect of just,Non-Spam
total disappointment when texte be crazy,Non-Spam
want tell how bad feel that basically only time text lately be when,Non-Spam
go,Non-Spam
that s,Non-Spam
be big,Non-Spam
no do not want,Non-Spam
can pls send i that company,Non-Spam
by way ve put skip right outside front of house so can see which house just pull up,Non-Spam
mile smile r make frm same letter but do know d smile on ur face keep i happy even though be mile away from keep smile,Non-Spam
ya m referin mei s ex wat no ah waitin 4 treat somebody shld b rich liao so gd den dun have work frm,Non-Spam
be great role be give so much really wish each day for miracle but god as reason for everything must say wish know why but do ve look up since be young still do have,Non-Spam
oh okie lor we go,Non-Spam
yes please leave at lt so that at lt gt we,Non-Spam
just,Non-Spam
it s reassure this,Non-Spam
go,Non-Spam
lol they be mad at first but then they wake,Non-Spam
machan go gym tomorrow wil come,Non-Spam
want be inside,Non-Spam
god s love have no god s grace have no god s power have no may have god s endless blessing always ur,Non-Spam
what tell before stupid hear after will not tell dad call my brother not,Non-Spam
will msg after lt,Non-Spam
perhaps much easy give your account identification so will tomorrow,Non-Spam
apo all other be mokka,Non-Spam
love have one law make happy person same way friendship have one law never make ur friend feel alone until be alive,Non-Spam
now get step 2 outta,Non-Spam
why do wake up on my,Non-Spam
yes trust buy new stuff asap so can try,Non-Spam
good afternoon my love how go your how do hope your well my boytoy,Non-Spam
cool we shall go see have go tip be at home get something drop so let go town maybe mum can,Non-Spam
think if he rule tamilnadu then its very tough for,Non-Spam
study sch or go anyway will b go 2,Non-Spam
k will sent,Non-Spam
oh thank lot already buy,Non-Spam
k will sent,Non-Spam
ofcourse also upload,Non-Spam
also fuck your family for go rhode island or wherever fuck leave i all alone week have new,Non-Spam
pick they up from various point go 2 yeovil they will do motor project 4 3 hour then take they 12 2 5 30,Non-Spam
so li i bore now da lecturer repeat last week stuff,Non-Spam
shall call now dear,Non-Spam
have see who be back,Non-Spam
really do hope work do not get have,Non-Spam
no probably,Non-Spam
what today sunday sunday holiday so,Non-Spam
yes want please every your wish,Non-Spam
dhoni have luck win some big title so we,Non-Spam
where be mummy s he be good or he be positive or why mummy be make,Non-Spam
ok lor reach then,Non-Spam
well obviously not because all people my cool college life go,Non-Spam
,Non-Spam
think,Non-Spam
,Non-Spam
shall bring we bottle of wine keep we only i ll bring,Non-Spam
will treasure every moment we,Non-Spam
goin,Non-Spam
ok thk get it then wan i 2 come now,Non-Spam
if hear loud scream about lt gt minute its cause my gyno will be shove thing up i that do,Non-Spam
sorry will,Non-Spam
arun can transfr i,Non-Spam
wish beautiful each moment reveal even more thing keep do,Non-Spam
i m just wonder what your do,Non-Spam
except there s chick with,Non-Spam
hello wat talk,Non-Spam
just sing think its also important find someone female that know place well preferably citizen that also smart help navigate even thing like choose phone plan require when doubt ask,Non-Spam
sac need,Non-Spam
aight we can pick some up open,Non-Spam
so that take away some,Non-Spam
be good let i know if need any of shall tell,Non-Spam
that be fine get enough bud last most of night,Non-Spam
good at repair shop only reason m up at,Non-Spam
think would get he watch just cos that s kind of thing he love,Non-Spam
by way make sure get train worc foregate street not shrub have fun,Non-Spam
do generally,Non-Spam
hey ve book 2 lesson on,Non-Spam
what be youdoe,Non-Spam
be slow use biola,Non-Spam
mode man or,Non-Spam
m wif he now buy,Non-Spam
jesus armand really try tell everybody he,Non-Spam
be go to have be way more specific,Non-Spam
thanx lot 4,Non-Spam
if be be not,Non-Spam
if can make it any time tonight or whenever can it be cool just text i whenever,Non-Spam
er yeah will b there at 15 26 just tell i which pub cafe sit come,Non-Spam
do not complete your,Non-Spam
oh my diet just fly,Non-Spam
otherwise have part time job,Non-Spam
horrible gal know dat be go out wif he y n still come n,Non-Spam
sorry will,Non-Spam
ok k sry knw 2 siva tat,Non-Spam
hi elaine today s,Non-Spam
do not know hopefully,Non-Spam
m at bruce amp fowler now but m my mom s car so can not park,Non-Spam
so how be what be how be,Non-Spam
just forgot will show,Non-Spam
my want take 2 or 3 picture of yourself today bright light on your cell,Non-Spam
should get more chicken broth if want raman unless there be some do not,Non-Spam
,Non-Spam
nite nite pocay wocay luv more than n e thing 4eva promise,Non-Spam
so how do handle victoria island plus when s,Non-Spam
ask if meet da ge,Non-Spam
daddy shu shu look 4 wan i 2 tell he be not singapore,Non-Spam
there first time,Non-Spam
,Non-Spam
yup he msg i tat then tot it be my group mate cos we meet today mah m askin if leave early or wat mah cos mayb haf walk,Non-Spam
dear be angry be,Non-Spam
so how many day,Non-Spam
pls give her prometazine 5mls then lt gt min,Non-Spam
so gd get free ice cream,Non-Spam
hi babe its me thank for come even though it do not go that just want my hope see soon love,Non-Spam
babes think get ur brolly leave it english wil bring it 2mrw 4,Non-Spam
hard but true how much show amp express your love someone that much it will hurt when they leave or get,Non-Spam
he be apparently bff with carly,Non-Spam
hi hope have good have,Non-Spam
that be,Non-Spam
as want custom officer,Non-Spam
dunno lei shd b driving lor cos go sch 1,Non-Spam
do not know exactly could,Non-Spam
all do all do not know if mega shop asda count as celebration but that s what,Non-Spam
ooooooh forgot tell can get on yoville on,Non-Spam
watch ajith,Non-Spam
not joke,Non-Spam
ok ok ok then what s ur,Non-Spam
not much no it be,Non-Spam
will be gentle soon will be take all lt gt inch deep inside your,Non-Spam
m at,Non-Spam
how do friend help we they give most stupid suggestion that land we into another problem help we forgt,Non-Spam
how be hope your do ok have shit night fall asleep at 5 i m knackered i m dread work what be thou upto,Non-Spam
good day too pray for me remove tooth as its painful maintain,Non-Spam
can make it up there squeeze lt gt buck out of,Non-Spam
its sunny weather s,Non-Spam
somebody set up website where can play hold em use eve,Non-Spam
do not want but m barely do what can stay fight with constantly,Non-Spam
can not pick phone right pls,Non-Spam
do konw waht rael friendship i m gve yuo an exmpel jsut ese tihs msg evrey spllee of tihs msg wrnog bt sitll yuo can raed it wihtuot ayn mitsake goodnight amp have nice sleep,Non-Spam
k will head out few min,Non-Spam
any problem frm,Non-Spam
lol oh get friend,Non-Spam
hi mom we might be back later than,Non-Spam
just try figure out when m suppose see couple different people this we say we would get together but do not,Non-Spam
think your mentor but not 100,Non-Spam
m inside office still fill forms don know when they,Non-Spam
yep get with,Non-Spam
hey iouri give i your number m wylie ryan,Non-Spam
this ur face test 1 2 3 4 5 6 7 8 9 lt gt select any number will tell ur face astrology be,Non-Spam
shall bring bottle of wine keep we just will still bring red or,Non-Spam
,Non-Spam
tell i something that,Non-Spam
live very simple love also simple laugh too simple win tooo simple but be simple,Non-Spam
aiyo cos sms then neva reply so wait 4 reply tot have not finish ur,Non-Spam
guai shd haf see he when he be naughty so free can,Non-Spam
good morning have,Non-Spam
yup it be at paragon have not decide whether 2 cut,Non-Spam
no one may be some,Non-Spam
,Non-Spam
do think put it,Non-Spam
no that be why have an 8 hr trip on bus last week have another audition next wednesday but think might drive,Non-Spam
my parent my kidz my friend n my all scream be wait on,Non-Spam
wat,Non-Spam
when guy plan on,Non-Spam
no no opening for that room til after thanksgive without,Non-Spam
of course should,Non-Spam
be there,Non-Spam
would like that would,Non-Spam
so when do wan,Non-Spam
my birthday on feb lt,Non-Spam
sound well than my evening i m just do my i m not sure what time finish tomorrow but will txt,Non-Spam
no it be not m almost lt gt year old should not be takin money from my be not suppose have deal with this this grownup stuff why do,Non-Spam
garbage bag egg jam bread hannaford,Non-Spam
neither sterm voice m all fine with i not sure thing will be resolve anyway have,Non-Spam
think steyn surely get,Non-Spam
x course it just so her message on messenger lik r,Non-Spam
dude i m no long i m an,Non-Spam
sir wait for,Non-Spam
sweet heart,Non-Spam
wish,Non-Spam
what make,Non-Spam
gal n boy walk d gal can hold ur boy do think would run gal no jst wana c how it feel walk heaven with an,Non-Spam
dear sir salam alaikkum pride pleasure meeting today at tea shop we be please send our contact number at qatar rakhesh an indian pls save our number,Non-Spam
aah how be,Non-Spam
thank will keep,Non-Spam
ok no problem yup m go sch at 4 if,Non-Spam
but we have not get da topic,Non-Spam
kothi print,Non-Spam
good morning my love go sleep now wish great day full of feel well opportunity be my last thought babe,Non-Spam
k fyi m back my parent place south tampa so might need do deal,Non-Spam
jus finish,Non-Spam
hahaha use your,Non-Spam
my sister going earn more than,Non-Spam
here get ur favorite oyster n get my favorite sashimi ok lar dun say already wait ur stomach,Non-Spam
k k m go tirunelvali this week see my uncle already spend amount by take dress so only want money i will give it on,Non-Spam
yeah that be what,Non-Spam
jolly by way will give ticket for sat eve 7 speak before,Non-Spam
m come back on it go to be ok get oh yeah how everything how s school or do call it,Non-Spam
what,Non-Spam
ill be at yours about 3 min but look out,Non-Spam
hi miss your call my mumhas beendroppe red wine all over what,Non-Spam
pls ask macho how much budget for bb bold 2 cos see new one for lt,Non-Spam
but it will tell quite long cos have not finish my,Non-Spam
about lt gt bank fee be well call bank,Non-Spam
at what time should,Non-Spam
can not make,Non-Spam
well good morning how s london treatin,Non-Spam
i ll hand she my phone,Non-Spam
my darling how be when be school there minimum wait period before do,Non-Spam
be come,Non-Spam
alex say he be not ok with not be ok,Non-Spam
donno its your gene,Non-Spam
xy try smth eat we,Non-Spam
dear,Non-Spam
congrat i d luv 2 but i ve have 2,Non-Spam
an excellent thought by misundrstud frnd knw hate i bt day wen will knw truth will hate,Non-Spam
hey do not forget be mine for i my possession my property mmm,Non-Spam
m still pretty weak today,Non-Spam
send i ur email i,Non-Spam
yeah probably here,Non-Spam
have go into get info bt do not know,Non-Spam
how will do,Non-Spam
vikky come around lt,Non-Spam
helloooo wake sweet morning welcome enjoy this day with full of joy,Non-Spam
good msg it be hard be with person when know that one more step foward will make fall love amp one step back can ruin ur friendship,Non-Spam
dunno leh can not remember mayb so wat time r we,Non-Spam
oh yeah clearly it be,Non-Spam
hi hope ur day back from walk table book for half let i know when ur,Non-Spam
its too late but its k,Non-Spam
hello how do what be up when will b move out of flat cos will need arrange pick up lamp take,Non-Spam
so wan 2 come for our dinner,Non-Spam
do fix if not do it asap ok,Non-Spam
er enjoyin indians at mo sall good hehe how s bout,Non-Spam
anything lar then not go home,Non-Spam
hi darlin its kate be up for doin somethin i m go pub call swan or something with my parent for one drink so phone i,Non-Spam
gud ni8 swt drms,Non-Spam
storm msg wen lift d phne say hello do knw wt d real meaning of it be d name of yes knw who dat margaret hello she d girlfrnd f grahmbell who invnte moral one can 4get d name of person bt not his girlfrnd g o o d n g,Non-Spam
pls speak with i will not ask anything other,Non-Spam
do see,Non-Spam
absolutely love south only recently start,Non-Spam
if anyone call for treadmill say will buy it make sure its find an ad on craigslist selling for,Non-Spam
can help swoop by pick up from wherever ur other bird r meeting,Non-Spam
1,Non-Spam
as usual iam fine happy amp,Non-Spam
well she be for,Non-Spam
ok,Non-Spam
do not get,Non-Spam
please tell i not all of my car key be,Non-Spam
do your study alone without anyone if can not no,Non-Spam
yeah work fine start last week all same stuff as before dull but easy guy,Non-Spam
k m leave soon be there little,Non-Spam
come n search tat vid,Non-Spam
gud ni8 dear slp well take care swt,Non-Spam
have not eat all m sit here stare at this juicy pizza can not eat these med be ruin,Non-Spam
thank want see your nice,Non-Spam
thank for temale it be thank have,Non-Spam
of do not tease i know simply must grin do keep i post my prey love smile,Non-Spam
hmm,Non-Spam
its part of,Non-Spam
gud gud k chikku tke care sleep well,Non-Spam
jay want work out first how be,Non-Spam
yeah can still,Non-Spam
be on uworld be buy qbank only or be buy it with self,Non-Spam
ok see,Non-Spam
hey what how about your start,Non-Spam
realise be busy guy m try not be have get some exam outta way then try do have,Non-Spam
nope m,Non-Spam
it mean could not keep,Non-Spam
re meet alex nichols from middle school it turn out he,Non-Spam
prabha m soryda realy frm heart,Non-Spam
smile pleasure smile pain smile when trouble pour like rain smile when sum1 hurt smile becoz someone still loves,Non-Spam
oh juswoke up bed on boatin slept wid 25 year giv da gossip,Non-Spam
if die want have all,Non-Spam
5 night we not stay at port step liao,Non-Spam
jane babes not goin 2 wrk feel ill after lst fone already cover 4,Non-Spam
have take exam with,Non-Spam
pls she need dat slowly or she will,Non-Spam
accidentally bring em,Non-Spam
well that s too bad can not,Non-Spam
be will be,Non-Spam
keep ten r my shelf buy,Non-Spam
3 pa but,Non-Spam
k k how your,Non-Spam
it only yesterday,Non-Spam
dai download but there only exe file which can only run that exe,Non-Spam
know be thinkin but relax child can not handle she would have be bad its if she take enough replace her loss her temp will if give her malaria med now she will just its self limit illness she have which mean few day it will,Non-Spam
hi what think,Non-Spam
babe m answer can not see maybe would well reboot ym get photo it,Non-Spam
will reach ur home lt,Non-Spam
how come she can get should b quite diff,Non-Spam
i fine,Non-Spam
wot student discount can get,Non-Spam
ugh my leg musta overdo it,Non-Spam
she s have have difficulty with her it work with can pls send she another,Non-Spam
like but i m happy splash out on wine if it make,Non-Spam
darren be say dat if meet da ge den we dun meet 4 cos later leave xy will feel den meet he 4,Non-Spam
ok take ur time n enjoy,Non-Spam
it be wylie tampa,Non-Spam
oh oh den muz change plan liao go back have yan,Non-Spam
sorry will,Non-Spam
,Non-Spam
what,Non-Spam
upload,Non-Spam
just cook rather nice,Non-Spam
m town now so will jus take mrt,Non-Spam
fuuuuck need stop,Non-Spam
send they,Non-Spam
k sure be my relative sms i,Non-Spam
fucking love fuck it be so good hear your so need crave it can not get adore,Non-Spam
hi hope r both ok he say he would text he have not have see he let i down,Non-Spam
very be watch 2nd one now but m sweet,Non-Spam
company very good environment terrific food,Non-Spam
raji pls do i pls convey my birthday wish nimya today,Non-Spam
water log,Non-Spam
,Non-Spam
aight text i tonight we will see what,Non-Spam
oh k will,Non-Spam
m school now n will be da lab do some stuff give i call when,Non-Spam
now m go,Non-Spam
i ve get some salt can rub it my open wound,Non-Spam
oh do,Non-Spam
y she dun believe tot tell she it be true thk she muz c us tog then,Non-Spam
still get,Non-Spam
ok leave no,Non-Spam
just send we will,Non-Spam
lol just need cash my hurry come on before,Non-Spam
ok then r we,Non-Spam
no but bluray,Non-Spam
will come with karnan please wait till 6 pm will directly,Non-Spam
k k sms chat,Non-Spam
sir need velusamy sir s date of birth company bank,Non-Spam
my new year eve be go party with my who this si,Non-Spam
like lt gt,Non-Spam
have not leave yet so probably go to be here,Non-Spam
m sit here stop shop parking lot right now bawl my eye out because feel like m failure nobody want i now feel like,Non-Spam
no problem with i ll do it right away but do not know,Non-Spam
happy new year ur family may this new year bring happiness stability tranquility ur vibrant,Non-Spam
pls call i da,Non-Spam
k then come wenever lik come also tel vikky come by get,Non-Spam
oh unintentionally not bad finger train play will give fifteen,Non-Spam
aiyar so poor thing give my support k will,Non-Spam
m office now da,Non-Spam
hi darlin i m on helens fone i m go to b up prince 2 nite please come up tb,Non-Spam
now that have start do not just pray for more good idea anything see that can help guy i ll,Non-Spam
yeah imagine he would be really unlike other doc who treat their patient,Non-Spam
oh shut omg yesterday have dream that have 2 kid both boy be so not only about kid but they be even tell mark my dream that he be change diaper cause m not getting,Non-Spam
yup have not be there before want go for can call,Non-Spam
there be some nice pub near here or there frankie n bennys near,Non-Spam
sorry be,Non-Spam
sday only joined so training we,Non-Spam
hmm dunno leh mayb bag 4 goigng out dat not too or ju anything except perfume smth dat,Non-Spam
it be still not this time also try add that be checking,Non-Spam
that will go over so can do my will do it,Non-Spam
any way where be,Non-Spam
rise for red red for blood blood for heart heart for u but for i send tis all ur friend include i if like i if get back 1 u r poor 2 u need some 1 support 3 u r frnd 2 many 4 some1 luvs 5 some1 pray god marry u,Non-Spam
wot about on we d nite am 3 then but only,Non-Spam
cuz don wan,Non-Spam
wonderful okor have great we cherish guy wish well each,Non-Spam
after my work ah den 6 plus lor workin oso rite den go orchard lor no other place,Non-Spam
he impossible argue with he always treat i like his sub like he never release i which he do will remind he of that,Non-Spam
hi chikku send some,Non-Spam
not enufcredeit tocall shall ileave uni at 6 get bus,Non-Spam
oop do have it,Non-Spam
lol for she tell my dad,Non-Spam
be drive,Non-Spam
aslamalaikkum insha allah tohar beeen muht albi mufti mahfuuz mean,Non-Spam
fill i with complete,Non-Spam
argh why fuck nobody,Non-Spam
definitely need module from e humanity dis sem wan 2 take other,Non-Spam
ve reach,Non-Spam
oh get,Non-Spam
sign of maturity not when we start say big thing but actually it when we start understand small thing have nice,Non-Spam
really need 2 kiss miss my baby from ur,Non-Spam
de i on ya break blacko,Non-Spam
wnt buy bmw car urgently its vry urgent but hv shortage of lt gt lacs there no source arng dis lt gt lac that s,Non-Spam
boy love he propsd bt she do not he gv lv lttrs bt her frnd throw again d boy decide 2 aproach d gal dt time truck be speed towards d wn it be about 2 hit d girl d boy run like hell n save she ask hw cn run so d boy reply boost d secret of my energy n instantly d girl shout our energy n thy live happily 2gthr drinking boost evrydy moral of d story hv free msgs d,Non-Spam
other news after hassle i get he weed for week andre have no,Non-Spam
nope that s might have,Non-Spam
aight call i once,Non-Spam
ah well that confuse thing do not think be friend with maybe do wrong thing but already sort of invite tho he may not come cos,Non-Spam
sorry about that this my mate phone do not write it,Non-Spam
but m really really break oh no amount too small even,Non-Spam
k k this month kotee,Non-Spam
hi shanil rakhesh here thank have exchange uncut diamond stuff leave excellent service by,Non-Spam
gokila talk,Non-Spam
my fri ah okie lor goin 4 my drivin den go shoppin,Non-Spam
no will check all room,Non-Spam
st andre virgil,Non-Spam
what type of stuff,Non-Spam
will not do,Non-Spam
good morning i m suffer from fever dysentry will not be able come,Non-Spam
omg if its not one thing its my cat have worm when do this bad,Non-Spam
sorry miss your can please,Non-Spam
hey,Non-Spam
aiya we discuss later lar pick up at,Non-Spam
amazing if rearrange these letter it give same meaning dormitory dirty room astronomer moon starer eye they see election result lie let recount mother in law woman hitler eleven plus two twelve plus one,Non-Spam
keep ur problem ur heart b coz nobody will fight for u only amp have fight for ur self amp win vivekanand g 9 t sd ham yeah give i call if ve get minute ham hi babe feellikw shit justfound out via aletter thatmum gotmarrie 4thnov behind ourback selfish deviousbitch anyway i,Non-Spam
mark work he get out at his work by your house so he can,Non-Spam
guy no flash i now if go call i call how take,Non-Spam
well m glad do not find it totally,Non-Spam
want send lt gt mesage that s y sorry,Non-Spam
gud ni8 dear slp well take care swt,Non-Spam
as,Non-Spam
hai dear friend this my new amp present number by rajitha,Non-Spam
talk g x,Non-Spam
call afternoon onword mtnl service get problem south can hear but can not,Non-Spam
but your brother transfer only lt gt lt,Non-Spam
dunno lei like,Non-Spam
ok also wan 2 watch e 9,Non-Spam
have not stick at orchard my dad s go 4 dinner so r they,Non-Spam
sorry will call be,Non-Spam
think be disturb,Non-Spam
geeeee your internet really bad,Non-Spam
hey next sun 1030 there be basic yoga course at bugis we can go for that pilate intro next sit tell i what time,Non-Spam
goodnight da thangam really,Non-Spam
be on train back from northampton so m afraid not m staying skyve off today ho will be around wednesday do fancy comedy club this week,Non-Spam
lmao know i,Non-Spam
tick tick tick where could die of loneliness pout stomp,Non-Spam
with my sis lor we juz watch,Non-Spam
will vote for wherever my heart,Non-Spam
yeah so basically any time next week can get away from your mom amp get up,Non-Spam
hmmm still we do not,Non-Spam
desires go doctor 4 get bit get ur hair manage that,Non-Spam
we have send jd for customer service cum account executive ur mail i d for detail,Non-Spam
dunno my dad say he come home 2 bring we out 4 yup go w call when reach,Non-Spam
o ic should play 9 door,Non-Spam
she run off with young we will make pretty,Non-Spam
pls clarify back if an open return ticket that have can be prepone for i go,Non-Spam
thank for be there for i just talk on be very dear cherish have as brother,Non-Spam
do not hear it,Non-Spam
how many time tell stage all use not,Non-Spam
want,Non-Spam
be really good see other day dudette,Non-Spam
ok vl do know get,Non-Spam
hey very inconvenient for your sis,Non-Spam
there come friday leave for do get any news from your,Non-Spam
go chase after she run she over while she be,Non-Spam
be go to ask lol but think its,Non-Spam
,Non-Spam
anyway holla at i whenever be around because need an excuse go creep on,Non-Spam
yes its possible but dint pls do not tell any,Non-Spam
sad,Non-Spam
it be cool we can last little get more any,Non-Spam
how,Non-Spam
what be where who be do think of i be be good boy be miss do,Non-Spam
hey gal all wan na meet 4 dinner at,Non-Spam
think other two still need get cash but we can def be ready,Non-Spam
hello geeee m miss like send tm remind m think of be love,Non-Spam
uncle g just check up do have,Non-Spam
attend ur drive lesson how many time wk n,Non-Spam
by way rencontre meet mountain,Non-Spam
my mobile number pls sm ur mail id convey regard achan amma,Non-Spam
go fool do not cheat,Non-Spam
oh k will,Non-Spam
ill b,Non-Spam
